{
  "$schema": "http://json-schema.org/draft-07/schema#",
  "title": "SmartAbp Template Metadata",
  "description": "Describes the metadata for a SmartAbp code template.",
  "type": "object",
  "required": [
    "id",
    "version",
    "name",
    "description",
    "type",
    "placeholders"
  ],
  "properties": {
    "id": {
      "type": "string",
      "description": "The unique identifier for the template, typically the template's filename without extension."
    },
    "version": {
      "type": "string",
      "pattern": "^\\d+\\.\\d+\\.\\d+$",
      "description": "The semantic version of the template."
    },
    "name": {
      "type": "string",
      "description": "A human-readable name for the template."
    },
    "description": {
      "type": "string",
      "description": "A detailed description of what the template generates and its purpose."
    },
    "tags": {
      "type": "array",
      "items": {
        "type": "string"
      },
      "description": "Keywords to help categorize and search for the template."
    },
    "author": {
      "type": "string",
      "description": "The author or team responsible for the template."
    },
    "type": {
      "type": "string",
      "enum": ["C#", "Vue", "TypeScript", "JSON", "Markdown"],
      "description": "The primary language or framework of the template."
    },
    "placeholders": {
      "type": "array",
      "description": "An array of placeholder definitions used in the template.",
      "items": {
        "type": "object",
        "required": ["name", "description", "required"],
        "properties": {
          "name": {
            "type": "string",
            "pattern": "^\\{\\{[a-zA-Z0-9_]+\\}\\}$",
            "description": "The placeholder string, e.g., '{{ entityName }}'."
          },
          "description": {
            "type": "string",
            "description": "A clear explanation of what this placeholder represents."
          },
          "required": {
            "type": "boolean",
            "description": "Whether this placeholder must be filled."
          },
          "defaultValue": {
            "type": "string",
            "description": "A default value if the placeholder is optional and not provided."
          }
        }
      }
    },
    "relatedTemplates": {
      "type": "array",
      "description": "A list of other template IDs that are commonly used with this one.",
      "items": {
        "type": "string"
      }
    }
  }
}
