{
  "$schema": "../../template.schema.json",
  "id": "CreateEntityDto",
  "version": "1.1.0",
  "name": "Create Entity DTO",
  "description": "为实体生成标准的Create DTO，用于创建新实体的数据传输。",
  "tags": ["Backend", "Contracts", "DTO", "Create"],
  "author": "SmartAbp Core Team",
  "type": "C#",
  "placeholders": [
    {
      "name": "{{entityName}}",
      "description": "实体名称 (PascalCase)，例如：'Product'。",
      "required": true
    }
  ],
  "relatedTemplates": [
    "UpdateEntityDto",
    "EntityDto",
    "CrudAppService"
  ]
}
